{
  "source_id": "myth-norse-001",
  "title": "The Poetic Edda",
  "origin": "public domain edition",
  "source_type": "public_domain_text",
  "owner": "public",
  "license": "public_domain",
  "rights_basis": "owned_or_public_domain",
  "policy_category": "train_and_rag",
  "allowed_for_training": true,
  "allowed_for_rag": true,
  "collected_at": "2026-04-05",
  "reviewed_by": "platform-team",
  "review_status": "approved",
  "removal_contact": "not_applicable_public_domain",
  "removal_required": false,
  "content_hash": "sha256:3333333333333333333333333333333333333333333333333333333333333333",
  "notes": "Approved for narrative style and mythic motif extraction."
}
