{
  "source_id": "rules-srd-001",
  "title": "Rules Reference Excerpt Pack",
  "origin": "licensed distributor export",
  "source_type": "rulebook_excerpt",
  "owner": "third_party",
  "license": "ogl_reference_only",
  "rights_basis": "licensed_for_rag_only",
  "policy_category": "rag_only",
  "allowed_for_training": false,
  "allowed_for_rag": true,
  "collected_at": "2026-04-05",
  "reviewed_by": "platform-team",
  "review_status": "approved_rag_only",
  "removal_contact": "licensing@publisher.example",
  "removal_required": true,
  "content_hash": "sha256:5555555555555555555555555555555555555555555555555555555555555555",
  "notes": "May be indexed for grounding and citations but excluded from training exports."
}
